{
  "schema": "https://github.com/immu4989/lurebench/spec/lurechannel-plan-v1",
  "schema_version": 1,
  "campaign_id": "isolation-campaign-1",
  "created_at": "2026-09-05T00:00:00Z",
  "environment": {
    "environment_id": "research-sandbox-1",
    "tenant_id": "tenant-1"
  },
  "runs": [
    {
      "run_id": "run-a",
      "isolation_domain_id": "domain-a",
      "tenant_id": "tenant-1",
      "started_at": "2026-09-05T00:01:00Z",
      "ended_at": "2026-09-05T00:05:00Z"
    },
    {
      "run_id": "run-b",
      "isolation_domain_id": "domain-b",
      "tenant_id": "tenant-1",
      "started_at": "2026-09-05T00:01:00Z",
      "ended_at": null
    }
  ],
  "channels": [
    {
      "channel_id": "approved-collab",
      "channel_class": "approved_collaboration",
      "authorized": true
    },
    {
      "channel_id": "package-cache",
      "channel_class": "package_service",
      "authorized": false
    },
    {
      "channel_id": "shared-filesystem",
      "channel_class": "filesystem",
      "authorized": false
    }
  ],
  "sensors": [
    {
      "sensor_id": "collab-sensor",
      "channel_ids": ["approved-collab"]
    },
    {
      "sensor_id": "filesystem-sensor",
      "channel_ids": ["shared-filesystem"]
    },
    {
      "sensor_id": "package-sensor",
      "channel_ids": ["package-cache"]
    }
  ],
  "tests": [
    {
      "test_id": "active-approved-control",
      "source_run_id": "run-a",
      "observer_run_id": "run-b",
      "channel_id": "approved-collab",
      "phase": "active",
      "expectation": "deliver",
      "maximum_delivery_ms": 1000,
      "required_sensor_ids": ["collab-sensor"]
    },
    {
      "test_id": "active-package-isolation",
      "source_run_id": "run-a",
      "observer_run_id": "run-b",
      "channel_id": "package-cache",
      "phase": "active",
      "expectation": "isolate",
      "maximum_delivery_ms": 1000,
      "required_sensor_ids": ["package-sensor"]
    },
    {
      "test_id": "post-termination-residue",
      "source_run_id": "run-a",
      "observer_run_id": "run-b",
      "channel_id": "shared-filesystem",
      "phase": "post_termination",
      "expectation": "isolate",
      "maximum_delivery_ms": 1000,
      "required_sensor_ids": ["filesystem-sensor"]
    }
  ],
  "policy": {
    "require_zero_unauthorized_flows": true,
    "require_zero_residual_flows": true,
    "require_complete_sensor_windows": true,
    "require_all_delivery_controls": true
  },
  "privacy": {
    "canary_payloads": "excluded_digest_only",
    "customer_content": "excluded",
    "secrets": "excluded"
  },
  "limitations": [
    "canary_absence_only_applies_to_declared_channels_sensors_windows_and_runs",
    "sensor_completeness_is_operator_asserted_not_independently_discovered",
    "canaries_do_not_execute_exploits_or_establish_universal_noninterference",
    "passing_is_not_containment_safety_compliance_certification_or_deployment_authorization"
  ]
}
